{
  "id": "four_floors",
  "name": "Four Floors",
  "description": "Four levels of corridors. Staircases hide in dead ends and each one works both ways.",
  "difficulty": "medium",
  "levels": [
    [
      "Soooo.o",
      "....o.o",
      "ooooo.o",
      "o.....o",
      "o.Uoooo",
      "o...o.o",
      "ooooo.U"
    ],
    [
      "U.Uoooo",
      "o.....o",
      "ooooooo",
      "......o",
      "ooD.ooo",
      "o...o..",
      "ooooooD"
    ],
    [
      "D.Doooo",
      "o...o.o",
      "ooooo.o",
      "......o",
      "ooooU.o",
      "o.o...o",
      "U.ooooo"
    ],
    [
      "ooo.Foo",
      "..o...o",
      "o.ooooo",
      "o.....o",
      "ooooD.o",
      "o.o...o",
      "D.ooooo"
    ]
  ],
  "max_moves": 300
}
